{
  "name": "stats-plugin",
  "version": "2.0.0",
  "displayName": "Stats Dashboard",
  "description": "Track and visualize usage statistics across branches",
  "main": "index.js",
  "author": "Puffin",
  "license": "MIT",
  "keywords": ["stats", "metrics", "dashboard", "analytics"],
  "extensionPoints": {
    "actions": ["getStats", "exportStats"],
    "ipcHandlers": ["stats:getWeeklyStats", "stats:saveMarkdownExport"],
    "components": ["stats-view"]
  },
  "contributes": {
    "views": [
      {
        "id": "stats-view",
        "name": "Stats",
        "location": "nav",
        "icon": "ðŸ“Š",
        "order": 100,
        "component": "StatsView"
      }
    ],
    "commands": [
      {
        "id": "stats.showDashboard",
        "title": "Show Stats Dashboard",
        "category": "Stats"
      }
    ],
    "menus": {
      "tools": [
        {
          "command": "stats.showDashboard"
        }
      ]
    }
  },
  "activationEvents": [
    "onStartup"
  ],
  "renderer": {
    "entry": "renderer/components/index.js",
    "components": [
      {
        "name": "StatsView",
        "export": "StatsView",
        "type": "class",
        "description": "Main statistics dashboard view"
      }
    ],
    "styles": [
      "renderer/styles/stats-view.css",
      "renderer/styles/summary-cards.css",
      "renderer/styles/treemap.css",
      "renderer/styles/daily-trends.css",
      "renderer/styles/efficiency-chart.css",
      "renderer/styles/performance-table.css",
      "renderer/styles/stats-chart.css",
      "renderer/styles/stats-table.css",
      "renderer/styles/totals-row.css",
      "renderer/styles/chart-tooltip.css",
      "renderer/styles/export-button.css",
      "renderer/styles/notification.css"
    ]
  }
}
